{
  "date": "2026-06-01",
  "generated_at": "2026-06-01T05:00:00+09:00",
  "schema_version": "2.0",
  "headline": "Anthropic が Zero Trust for AI Agents 設計原則を公開（はてブ 311 件）・LiquidAI LFM2.5-8B-A1B が本日リリース・SoftBank が仏に最大 €750 億データセンター投資——Microsoft MagenticLite で小型モデル向けエージェント基盤が実用化、日本では無料 Web エージェント実装記事が 168 はてブ",
  "summary_ja": "6月1日は、AIエージェントのセキュリティ設計とモデルの多様化が同時に進んだ一日だった。Anthropicはエージェント時代のゼロトラスト設計原則をclaude.com/blogに公開し、日本のエンジニアコミュニティでははてなブックマーク311件の記録的反響を呼んだ。LiquidAIが本日LFM2.5-8B-A1Bをリリースし、MicrosoftはMAI-Image-2.5でArenaテキスト→画像リーダーボード3位を達成、さらにMagenticLiteで小型モデル向けエージェント基盤も発表した。インフラ・投資面ではSoftBankが仏に最大€750億のデータセンター投資を宣言し、GroqはNVIDIAとの大型ディール後に$6.5億の追加調達を追求している。日本では「Ollama×Playwright完全無料Webエージェント」Zenn記事が168はてブを集め、ローカルVLMを使ったエージェント実装への関心の高さが改めて示された。",
  "stats": {
    "total_collected": 120,
    "after_dedup": 70,
    "selected": 23,
    "top_picks_count": 6,
    "by_category": {
      "new_models": 2,
      "tools_apps": 3,
      "agents": 2,
      "multimodal": 2,
      "research_papers": 3,
      "industry_business": 2,
      "regulation_policy": 1,
      "community_buzz": 1,
      "japan": 5,
      "china": 2
    },
    "grounding_flags": 0
  },
  "top_picks": [
    {
      "id": "zero-trust-agents",
      "rank": 1,
      "reason": "Anthropic公式のAIエージェント向けゼロトラスト設計原則。はてブ311件でこの日の最大反響。エージェント権限設計の実践指針として即活用できる。"
    },
    {
      "id": "ollama-playwright-agent",
      "rank": 2,
      "reason": "ローカルVLM+Playwrightで完全無料のWebエージェントを実装した実践Zenn記事。168はてブでjapanカテゴリ最高スコア。APIコストゼロのエージェント構築を具体的に解説。"
    },
    {
      "id": "magentic-lite",
      "rank": 3,
      "reason": "Microsoftが小型モデル向けエージェントフレームワークMagenticLiteとMagenticBrainを発表。大規模モデル不要のエージェントAI展開を後押しする実用的フレームワーク。"
    },
    {
      "id": "ms-mai-image-25",
      "rank": 4,
      "reason": "MicrosoftのMAI-Image-2.5がArenaテキスト→画像リーダーボードで3位を達成。文字鮮明度・商業画像品質が向上し即日利用可能。"
    },
    {
      "id": "llm-working-memory",
      "rank": 5,
      "reason": "LLMに「ワーキングメモリ」を特殊トークン列で実装し、自己回帰的推論生成を廃して単一前向きパスで完結させる新手法。推論コスト削減の新アーキテクチャ。"
    },
    {
      "id": "videomla-kv",
      "rank": 6,
      "reason": "動画生成モデルのKVキャッシュメモリを92.7%削減するVideoMLA。分足スケールの自己回帰動画拡散を実現し、マルチモーダル推論コストを革新する。"
    }
  ],
  "categories": [
    {
      "id": "new_models",
      "label_ja": "新モデル・新発表",
      "label_en": "New Models",
      "items": [
        {
          "id": "liquidai-lfm25-8b",
          "title": "LiquidAI releases LFM2.5-8B-A1B on Hugging Face",
          "title_ja": "LiquidAI、LFM2.5-8B-A1B を本日 Hugging Face に公開",
          "url": "https://huggingface.co/LiquidAI/LFM2.5-8B-A1B",
          "source": "liquidai",
          "source_label": "LiquidAI (Hugging Face)",
          "source_type": "aggregator",
          "category": "new_models",
          "published_at": "2026-06-01",
          "lang": "en",
          "reaction_signal": {
            "kind": "hatena",
            "users": 0
          },
          "tags": [
            "LiquidAI",
            "LFM",
            "text-generation",
            "8B",
            "MoE"
          ],
          "scores": {
            "importance": 4,
            "depth": 3,
            "practicality": 4,
            "freshness": 5,
            "source_type_bias": 0,
            "total": 16
          },
          "summary_ja": "LiquidAIが開発する Liquid Foundation Model（LFM）シリーズの最新版 LFM2.5-8B-A1B が本日 Hugging Face に公開された。8B パラメータのテキスト生成モデルで、公開直後から 27.7K を超えるいいねを集め、コミュニティの注目度は高い。LiquidAI は非トランスフォーマー系の独自アーキテクチャで知られており、LFM シリーズは計算効率と長い文脈処理を訴求点としている。詳細なベンチマーク結果は追って公開される見込みだが、本日リリース分は Hugging Face 上で即時利用可能となっている。",
          "key_points_ja": [
            "LiquidAI の LFM2.5-8B-A1B が本日 Hugging Face に公開され、公開直後から 27.7K いいねを獲得した",
            "8B パラメータのテキスト生成モデルで Hugging Face から即時ダウンロード・利用が可能",
            "LiquidAI は独自アーキテクチャで計算効率を訴求するスタートアップで、LFM シリーズは非トランスフォーマー系設計が特徴",
            "詳細ベンチマーク結果は未公開だが、コミュニティの初期反応は強い"
          ],
          "figure": {
            "type": "summary-card",
            "data": {
              "headline": "LiquidAI LFM2.5-8B-A1B — 本日公開、27.7K HF いいね",
              "tldr": "LiquidAI の最新 8B テキスト生成モデルが本日 Hugging Face に登場。独自アーキテクチャで計算効率を訴求し、公開直後からコミュニティの高い関心を集めている。",
              "points": [
                {
                  "icon": "🤖",
                  "label": "モデル規模",
                  "value": "8B パラメータ",
                  "tone": "primary"
                },
                {
                  "icon": "🏷",
                  "label": "タスク",
                  "value": "テキスト生成",
                  "tone": "default"
                },
                {
                  "icon": "❤️",
                  "label": "HF いいね",
                  "value": "27.7K（公開当日）",
                  "tone": "success"
                },
                {
                  "icon": "🏢",
                  "label": "開発元",
                  "value": "LiquidAI",
                  "tone": "default"
                },
                {
                  "icon": "📅",
                  "label": "公開日",
                  "value": "2026-06-01（本日）",
                  "tone": "info"
                }
              ],
              "context": "LiquidAI はトランスフォーマーに依存しない独自の LFM アーキテクチャを開発しており、LFM シリーズは長文脈・計算効率を強みとする。",
              "impact": "API キーなしで HF から即試せる 8B モデルの登場は、個人開発者・研究者の実験コストを下げる。"
            },
            "alt": "LiquidAI LFM2.5-8B-A1B の概要カード。本日リリース。モデルサイズ 8B、タスク テキスト生成、HF いいね数 27.7K。LiquidAI 独自の Liquid Foundation Model アーキテクチャを採用。"
          }
        },
        {
          "id": "minicpm5-1b",
          "title": "OpenBMB releases MiniCPM5-1B — compact 1B text generation model",
          "title_ja": "OpenBMB、MiniCPM5-1B を公開——1B パラメータの軽量テキスト生成モデル",
          "url": "https://huggingface.co/openbmb/MiniCPM5-1B",
          "source": "openbmb",
          "source_label": "OpenBMB (Hugging Face)",
          "source_type": "aggregator",
          "category": "new_models",
          "published_at": "2026-05-26",
          "lang": "en",
          "tags": [
            "MiniCPM",
            "OpenBMB",
            "1B",
            "text-generation",
            "edge-AI"
          ],
          "scores": {
            "importance": 3,
            "depth": 3,
            "practicality": 4,
            "freshness": 3,
            "source_type_bias": 0,
            "total": 13
          },
          "summary_ja": "中国の清華大学系スタートアップ OpenBMB が MiniCPM5-1B を Hugging Face に公開した。わずか 10 億パラメータのコンパクトなテキスト生成モデルで、Hugging Face 上でのいいね数は 36.7K に達し、HF Trending 首位を記録している。MiniCPM シリーズは「スマートフォンや組み込みデバイスで動作する高品質小型 LLM」を訴求点としており、今回の第 5 世代版では精度と効率のバランスが前世代からさらに改善されたとされる。エッジデバイス上の LLM 推論を検討する開発者にとって最初の評価候補となるモデルだ。",
          "key_points_ja": [
            "OpenBMB の MiniCPM5-1B が HF Trending 首位、36.7K いいねを達成した超軽量テキスト生成モデル",
            "1B パラメータでスマートフォン・組み込みデバイス上での推論を想定した設計",
            "MiniCPM シリーズ第 5 世代で、エッジ LLM の精度・効率バランスをさらに向上",
            "Hugging Face から即時ダウンロード可能で、ローカル実行・微調整の敷居が低い"
          ],
          "figure": {
            "type": "summary-card",
            "data": {
              "headline": "MiniCPM5-1B — 36.7K HF いいね、エッジ LLM の最新世代",
              "tldr": "OpenBMB の MiniCPM シリーズ第 5 世代。1B パラメータでスマホ・組み込みデバイス向けに最適化され、HF Trending 首位を記録している。",
              "points": [
                {
                  "icon": "📦",
                  "label": "モデル規模",
                  "value": "1B パラメータ",
                  "tone": "primary"
                },
                {
                  "icon": "❤️",
                  "label": "HF いいね",
                  "value": "36.7K（Trending 1位）",
                  "tone": "success"
                },
                {
                  "icon": "📱",
                  "label": "想定用途",
                  "value": "エッジ・組み込み推論",
                  "tone": "info"
                },
                {
                  "icon": "🏢",
                  "label": "開発元",
                  "value": "OpenBMB（清華大系）",
                  "tone": "default"
                },
                {
                  "icon": "🔢",
                  "label": "世代",
                  "value": "MiniCPM 第 5 世代",
                  "tone": "default"
                }
              ],
              "context": "MiniCPM シリーズはスマートフォン上で動作する高品質 LLM を目標とし、低リソース環境での推論効率を重視した設計が特徴。",
              "impact": "ローカル LLM を試したい開発者がまず評価すべきモデルの一つ。API コストなしで組み込み推論PoC を始められる。"
            },
            "alt": "MiniCPM5-1B の概要カード。開発元 OpenBMB。パラメータ数 1B、HF いいね 36.7K で Trending 首位。エッジデバイス・組み込み向け設計。"
          }
        }
      ]
    },
    {
      "id": "tools_apps",
      "label_ja": "ツール・アプリ・SDK",
      "label_en": "Tools & Apps",
      "items": [
        {
          "id": "ms-mai-image-25",
          "title": "MAI-Image-2.5 launches at No. 3 on Arena text-to-image leaderboard",
          "title_ja": "Microsoft MAI-Image-2.5、Arena テキスト→画像リーダーボードで 3 位を達成",
          "url": "https://microsoft.ai/news/mai-image-2-5-launches-at-no-3-on-arena-ai/",
          "source": "microsoft",
          "source_label": "Microsoft AI",
          "source_type": "official",
          "category": "tools_apps",
          "published_at": "2026-05-26",
          "lang": "en",
          "tags": [
            "Microsoft",
            "text-to-image",
            "MAI-Image",
            "Arena",
            "image-generation"
          ],
          "scores": {
            "importance": 4,
            "depth": 3,
            "practicality": 4,
            "freshness": 3,
            "source_type_bias": 0,
            "total": 14
          },
          "summary_ja": "Microsoft が最新の画像生成モデル MAI-Image-2.5 をリリースし、Arena のテキスト→画像リーダーボードで 3 位を記録した。前世代の MAI-Image-2 と比べ、文字レンダリングの鮮明さ・レイアウト整合性・商業画像（パッケージラベル・製品写真）での品質が向上している。Arena AI とのインテグレーションに加え、MAI Playground での提供が開始され、Foundry への展開は発表から 2 週間以内に予定されている。Microsoft は視覚的推論能力（オブジェクト認識・シーン構造・照明・スケール・空間関係）の改善も強調しており、商業クリエイティブ用途での実用性が高まった。",
          "key_points_ja": [
            "MAI-Image-2.5 が Arena テキスト→画像リーダーボードで 3 位を獲得し、主要モデルに肩を並べた",
            "文字の鮮明さ・レイアウト整合性・商業画像品質（パッケージ・製品写真）が前世代から向上",
            "Arena.ai/image で即時利用可能、MAI Playground にも公開済み。Foundry 展開は 2 週間以内予定",